{
  "id": "stadium",
  "name": "otra.city Stadium",
  "kind": "stadium",
  "tagline": "the city's home ground \u2014 RFL, live at kick-off",
  "url": "https://otra.city/stadium",
  "route": "/stadium",
  "placement": {
    "x": 100,
    "z": 0,
    "yaw": 0
  },
  "footprint": {
    "min": [
      -26,
      -23
    ],
    "max": [
      26,
      23
    ],
    "height": 12
  },
  "tiers": {
    "near_m": 30,
    "inside_margin_m": 4,
    "hysteresis_m": 12,
    "unload_after_s": 20
  },
  "assets": {
    "far": "far.glb",
    "near": "venue.glb"
  },
  "collision_prefix": "col_",
  "lights": {
    "cap": 12000
  },
  "spawn": {
    "x": -28.0,
    "z": 0.0,
    "yaw": 1.5708
  },
  "gates": [
    {
      "id": "west",
      "left": "gate_w_L",
      "right": "gate_w_R",
      "at": [
        -26,
        0,
        0
      ],
      "slide_m": 1.4,
      "open_m": 3.2,
      "close_m": 4.0
    },
    {
      "id": "east",
      "left": "gate_e_L",
      "right": "gate_e_R",
      "at": [
        26,
        0,
        0
      ],
      "slide_m": 1.4,
      "open_m": 3.2,
      "close_m": 4.0
    }
  ],
  "anims": [],
  "audio_zone": {
    "min": [
      -24,
      -21
    ],
    "max": [
      24,
      21
    ]
  },
  "capacity": 150,
  "seats": [
    [
      -12.3,
      1.0,
      7.5
    ],
    [
      -12.3,
      1.0,
      6.9
    ],
    [
      -12.3,
      1.0,
      6.3
    ],
    [
      -12.3,
      1.0,
      5.7
    ],
    [
      -12.3,
      1.0,
      5.1
    ],
    [
      -12.3,
      1.0,
      4.5
    ],
    [
      -12.3,
      1.0,
      3.9
    ],
    [
      -12.3,
      1.0,
      3.3
    ],
    [
      -12.3,
      1.0,
      1.5
    ],
    [
      -12.3,
      1.0,
      0.9
    ],
    [
      -12.3,
      1.0,
      0.3
    ],
    [
      -12.3,
      1.0,
      -0.3
    ],
    [
      -12.3,
      1.0,
      -0.9
    ],
    [
      -12.3,
      1.0,
      -1.5
    ],
    [
      -12.3,
      1.0,
      -2.1
    ],
    [
      -12.3,
      1.0,
      -2.7
    ],
    [
      -12.3,
      1.0,
      -4.5
    ],
    [
      -12.3,
      1.0,
      -5.1
    ],
    [
      -12.3,
      1.0,
      -5.7
    ],
    [
      -12.3,
      1.0,
      -6.3
    ],
    [
      -12.3,
      1.0,
      -6.9
    ],
    [
      -12.3,
      1.0,
      -7.5
    ],
    [
      -13.3,
      1.5,
      7.5
    ],
    [
      -13.3,
      1.5,
      6.9
    ],
    [
      -13.3,
      1.5,
      6.3
    ],
    [
      -13.3,
      1.5,
      5.7
    ],
    [
      -13.3,
      1.5,
      5.1
    ],
    [
      -13.3,
      1.5,
      4.5
    ],
    [
      -13.3,
      1.5,
      3.9
    ],
    [
      -13.3,
      1.5,
      3.3
    ],
    [
      -13.3,
      1.5,
      1.5
    ],
    [
      -13.3,
      1.5,
      0.9
    ],
    [
      -13.3,
      1.5,
      0.3
    ],
    [
      -13.3,
      1.5,
      -0.3
    ],
    [
      -13.3,
      1.5,
      -0.9
    ],
    [
      -13.3,
      1.5,
      -1.5
    ],
    [
      -13.3,
      1.5,
      -2.1
    ],
    [
      -13.3,
      1.5,
      -2.7
    ],
    [
      -13.3,
      1.5,
      -4.5
    ],
    [
      -13.3,
      1.5,
      -5.1
    ],
    [
      -13.3,
      1.5,
      -5.7
    ],
    [
      -13.3,
      1.5,
      -6.3
    ],
    [
      -13.3,
      1.5,
      -6.9
    ],
    [
      -13.3,
      1.5,
      -7.5
    ],
    [
      -14.3,
      2.0,
      7.5
    ],
    [
      -14.3,
      2.0,
      6.9
    ],
    [
      -14.3,
      2.0,
      6.3
    ],
    [
      -14.3,
      2.0,
      5.7
    ],
    [
      -14.3,
      2.0,
      5.1
    ],
    [
      -14.3,
      2.0,
      4.5
    ],
    [
      -14.3,
      2.0,
      3.9
    ],
    [
      -14.3,
      2.0,
      3.3
    ],
    [
      -14.3,
      2.0,
      1.5
    ],
    [
      -14.3,
      2.0,
      0.9
    ],
    [
      -14.3,
      2.0,
      0.3
    ],
    [
      -14.3,
      2.0,
      -0.3
    ],
    [
      -14.3,
      2.0,
      -0.9
    ],
    [
      -14.3,
      2.0,
      -1.5
    ],
    [
      -14.3,
      2.0,
      -2.1
    ],
    [
      -14.3,
      2.0,
      -2.7
    ],
    [
      -14.3,
      2.0,
      -4.5
    ],
    [
      -14.3,
      2.0,
      -5.1
    ],
    [
      -14.3,
      2.0,
      -5.7
    ],
    [
      -14.3,
      2.0,
      -6.3
    ],
    [
      -14.3,
      2.0,
      -6.9
    ],
    [
      -14.3,
      2.0,
      -7.5
    ],
    [
      -15.3,
      2.5,
      7.5
    ],
    [
      -15.3,
      2.5,
      6.9
    ],
    [
      -15.3,
      2.5,
      6.3
    ],
    [
      -15.3,
      2.5,
      5.7
    ],
    [
      -15.3,
      2.5,
      5.1
    ],
    [
      -15.3,
      2.5,
      4.5
    ],
    [
      -15.3,
      2.5,
      3.9
    ],
    [
      -15.3,
      2.5,
      3.3
    ],
    [
      -15.3,
      2.5,
      1.5
    ],
    [
      -15.3,
      2.5,
      0.9
    ],
    [
      -15.3,
      2.5,
      0.3
    ],
    [
      -15.3,
      2.5,
      -0.3
    ],
    [
      -15.3,
      2.5,
      -0.9
    ],
    [
      -15.3,
      2.5,
      -1.5
    ],
    [
      -15.3,
      2.5,
      -2.1
    ],
    [
      -15.3,
      2.5,
      -2.7
    ],
    [
      -15.3,
      2.5,
      -4.5
    ],
    [
      -15.3,
      2.5,
      -5.1
    ],
    [
      -15.3,
      2.5,
      -5.7
    ],
    [
      -15.3,
      2.5,
      -6.3
    ],
    [
      -15.3,
      2.5,
      -6.9
    ],
    [
      -15.3,
      2.5,
      -7.5
    ],
    [
      -16.3,
      3.0,
      7.5
    ],
    [
      -16.3,
      3.0,
      6.9
    ],
    [
      -16.3,
      3.0,
      6.3
    ],
    [
      -16.3,
      3.0,
      5.7
    ],
    [
      -16.3,
      3.0,
      5.1
    ],
    [
      -16.3,
      3.0,
      4.5
    ],
    [
      -16.3,
      3.0,
      3.9
    ],
    [
      -16.3,
      3.0,
      3.3
    ],
    [
      -16.3,
      3.0,
      1.5
    ],
    [
      -16.3,
      3.0,
      0.9
    ],
    [
      -16.3,
      3.0,
      0.3
    ],
    [
      -16.3,
      3.0,
      -0.3
    ],
    [
      -16.3,
      3.0,
      -0.9
    ],
    [
      -16.3,
      3.0,
      -1.5
    ],
    [
      -16.3,
      3.0,
      -2.1
    ],
    [
      -16.3,
      3.0,
      -2.7
    ],
    [
      -16.3,
      3.0,
      -4.5
    ],
    [
      -16.3,
      3.0,
      -5.1
    ],
    [
      -16.3,
      3.0,
      -5.7
    ],
    [
      -16.3,
      3.0,
      -6.3
    ],
    [
      -16.3,
      3.0,
      -6.9
    ],
    [
      -16.3,
      3.0,
      -7.5
    ],
    [
      -17.3,
      3.5,
      7.5
    ],
    [
      -17.3,
      3.5,
      6.9
    ],
    [
      -17.3,
      3.5,
      6.3
    ],
    [
      -17.3,
      3.5,
      5.7
    ],
    [
      -17.3,
      3.5,
      5.1
    ],
    [
      -17.3,
      3.5,
      4.5
    ],
    [
      -17.3,
      3.5,
      3.9
    ],
    [
      -17.3,
      3.5,
      3.3
    ],
    [
      -17.3,
      3.5,
      1.5
    ],
    [
      -17.3,
      3.5,
      0.9
    ],
    [
      -17.3,
      3.5,
      0.3
    ],
    [
      -17.3,
      3.5,
      -0.3
    ],
    [
      -17.3,
      3.5,
      -0.9
    ],
    [
      -17.3,
      3.5,
      -1.5
    ],
    [
      -17.3,
      3.5,
      -2.1
    ],
    [
      -17.3,
      3.5,
      -2.7
    ],
    [
      -17.3,
      3.5,
      -4.5
    ],
    [
      -17.3,
      3.5,
      -5.1
    ],
    [
      -17.3,
      3.5,
      -5.7
    ],
    [
      -17.3,
      3.5,
      -6.3
    ],
    [
      -17.3,
      3.5,
      -6.9
    ],
    [
      -17.3,
      3.5,
      -7.5
    ],
    [
      12.3,
      1.0,
      7.5
    ],
    [
      12.3,
      1.0,
      6.9
    ],
    [
      12.3,
      1.0,
      6.3
    ],
    [
      12.3,
      1.0,
      5.7
    ],
    [
      12.3,
      1.0,
      5.1
    ],
    [
      12.3,
      1.0,
      4.5
    ],
    [
      12.3,
      1.0,
      3.9
    ],
    [
      12.3,
      1.0,
      3.3
    ],
    [
      12.3,
      1.0,
      1.5
    ],
    [
      12.3,
      1.0,
      0.9
    ],
    [
      12.3,
      1.0,
      0.3
    ],
    [
      12.3,
      1.0,
      -0.3
    ],
    [
      12.3,
      1.0,
      -0.9
    ],
    [
      12.3,
      1.0,
      -1.5
    ],
    [
      12.3,
      1.0,
      -2.1
    ],
    [
      12.3,
      1.0,
      -2.7
    ],
    [
      12.3,
      1.0,
      -4.5
    ],
    [
      12.3,
      1.0,
      -5.1
    ],
    [
      12.3,
      1.0,
      -5.7
    ],
    [
      12.3,
      1.0,
      -6.3
    ],
    [
      12.3,
      1.0,
      -6.9
    ],
    [
      12.3,
      1.0,
      -7.5
    ],
    [
      13.3,
      1.5,
      7.5
    ],
    [
      13.3,
      1.5,
      6.9
    ],
    [
      13.3,
      1.5,
      6.3
    ],
    [
      13.3,
      1.5,
      5.7
    ],
    [
      13.3,
      1.5,
      5.1
    ],
    [
      13.3,
      1.5,
      4.5
    ],
    [
      13.3,
      1.5,
      3.9
    ],
    [
      13.3,
      1.5,
      3.3
    ],
    [
      13.3,
      1.5,
      1.5
    ],
    [
      13.3,
      1.5,
      0.9
    ],
    [
      13.3,
      1.5,
      0.3
    ],
    [
      13.3,
      1.5,
      -0.3
    ],
    [
      13.3,
      1.5,
      -0.9
    ],
    [
      13.3,
      1.5,
      -1.5
    ],
    [
      13.3,
      1.5,
      -2.1
    ],
    [
      13.3,
      1.5,
      -2.7
    ],
    [
      13.3,
      1.5,
      -4.5
    ],
    [
      13.3,
      1.5,
      -5.1
    ],
    [
      13.3,
      1.5,
      -5.7
    ],
    [
      13.3,
      1.5,
      -6.3
    ],
    [
      13.3,
      1.5,
      -6.9
    ],
    [
      13.3,
      1.5,
      -7.5
    ],
    [
      14.3,
      2.0,
      7.5
    ],
    [
      14.3,
      2.0,
      6.9
    ],
    [
      14.3,
      2.0,
      6.3
    ],
    [
      14.3,
      2.0,
      5.7
    ],
    [
      14.3,
      2.0,
      5.1
    ],
    [
      14.3,
      2.0,
      4.5
    ],
    [
      14.3,
      2.0,
      3.9
    ],
    [
      14.3,
      2.0,
      3.3
    ],
    [
      14.3,
      2.0,
      1.5
    ],